{
  "metadata": {
    "version": "1.0.0",
    "generated_at": "2026-07-06T22:03:51.533880+00:00",
    "year_range": [
      2018,
      2025
    ],
    "n_total": 179,
    "n_clustered": 177,
    "act_disclaimer_es": "Los valores bajos de Chocó conviven con subregistro estructural documentado. Dos municipios fueron excluidos del modelo (códigos 27150 y 27493) por conteos casi nulos durante 8 años. La ausencia de casos en los datos no es ausencia de violencia.",
    "source_files": {
      "master_table": "data/master/master_table.parquet",
      "tabla_clustering_final": "data/master/tabla_clustering_final.parquet"
    }
  },
  "sub_acto_1_1": {
    "title_es": "",
    "anchor_text_es": "",
    "caveat_es": "Los 177 municipios incluyen todos los del universo excepto Carmen del Darién (27150) y Nuevo Belén de Bajirá (27493), excluidos del modelo por subregistro estructural sostenido (VIF=0 en todos los años analizados).",
    "stat_cards": [
      {
        "id": "n_municipios",
        "label_es": "municipios con modelo ICV",
        "display_format": "integer_thousands",
        "badge": null,
        "sub_value": null,
        "value": 177
      },
      {
        "id": "n_alta_severidad",
        "label_es": "en alta severidad",
        "display_format": "integer_thousands",
        "badge": null,
        "sub_value": {
          "value": 60.5,
          "label_es": "% de los 177 municipios con modelo"
        },
        "value": 107
      },
      {
        "id": "icv_promedio_regional",
        "label_es": "ICV-GEN-F promedio regional",
        "display_format": "decimal_2d",
        "badge": null,
        "sub_value": null,
        "value": 14.34
      }
    ]
  },
  "sub_acto_1_2": {
    "title_es": "PROVISIONAL: Título del mapa coroplético ICV-GEN-F",
    "anchor_text_es": "El ICV-GEN-F combina cuatro tasas de violencia (VIF + sexual × niñas + adultas) en un solo score 0–100. Más alto = más severo.",
    "caveat_es": "Los valores bajos de Chocó conviven con subregistro estructural documentado. Dos municipios fueron excluidos del modelo (códigos 27150 y 27493) por conteos casi nulos durante 8 años. La ausencia de casos en los datos no es ausencia de violencia.",
    "data": {
      "geo_join_key": "cod_municipio",
      "n_features": 179,
      "n_clustered": 177,
      "icv_range": {
        "min": 0.0,
        "max": 52.18
      },
      "cluster_legend": {
        "alta_severidad": {
          "cluster_id": 1,
          "color": "#d73027",
          "label": "Alta severidad"
        },
        "moderada_baja": {
          "cluster_id": 0,
          "color": "#fc8d59",
          "label": "Moderada / Baja"
        },
        "excluded": {
          "cluster_id": null,
          "color": "#bdbdbd",
          "label": "Sin modelo (subregistro estructural)"
        }
      },
      "features": [
        {
          "cod_municipio": "52001",
          "municipality": "PASTO",
          "department": "NARIÑO",
          "icv_average": 52.18,
          "cluster_id": 1,
          "cluster_name": "🔴 Alta severidad",
          "excluded_from_model": false,
          "lat": 1.08361,
          "lon": -77.2061
        },
        {
          "cod_municipio": "19001",
          "municipality": "POPAYAN",
          "department": "CAUCA",
          "icv_average": 45.85,
          "cluster_id": 1,
          "cluster_name": "🔴 Alta severidad",
          "excluded_from_model": false,
          "lat": 2.4717,
          "lon": -76.59194
        },
        {
          "cod_municipio": "76892",
          "municipality": "YUMBO",
          "department": "VALLE DEL CAUCA",
          "icv_average": 34.64,
          "cluster_id": 1,
          "cluster_name": "🔴 Alta severidad",
          "excluded_from_model": false,
          "lat": 3.59591,
          "lon": -76.51099
        },
        {
          "cod_municipio": "76606",
          "municipality": "RESTREPO",
          "department": "VALLE DEL CAUCA",
          "icv_average": 31.8,
          "cluster_id": 1,
          "cluster_name": "🔴 Alta severidad",
          "excluded_from_model": false,
          "lat": 3.8223200131253905,
          "lon": -76.52373163129324
        },
        {
          "cod_municipio": "76130",
          "municipality": "CANDELARIA",
          "department": "VALLE DEL CAUCA",
          "icv_average": 31.63,
          "cluster_id": 1,
          "cluster_name": "🔴 Alta severidad",
          "excluded_from_model": false,
          "lat": 3.408472511929937,
          "lon": -76.34866567299966
        },
        {
          "cod_municipio": "76001",
          "municipality": "CALI",
          "department": "VALLE DEL CAUCA",
          "icv_average": 30.27,
          "cluster_id": 1,
          "cluster_name": "🔴 Alta severidad",
          "excluded_from_model": false,
          "lat": 3.39904,
          "lon": -76.57649
        },
        {
          "cod_municipio": "19548",
          "municipality": "PIENDAMO  TUNIA",
          "department": "CAUCA",
          "icv_average": 29.75,
          "cluster_id": 1,
          "cluster_name": "🔴 Alta severidad",
          "excluded_from_model": false,
          "lat": 2.71446,
          "lon": -76.56472
        },
        {
          "cod_municipio": "76622",
          "municipality": "ROLDANILLO",
          "department": "VALLE DEL CAUCA",
          "icv_average": 28.8,
          "cluster_id": 1,
          "cluster_name": "🔴 Alta severidad",
          "excluded_from_model": false,
          "lat": 4.44357,
          "lon": -76.16824
        },
        {
          "cod_municipio": "76616",
          "municipality": "RIOFRIO",
          "department": "VALLE DEL CAUCA",
          "icv_average": 28.7,
          "cluster_id": 1,
          "cluster_name": "🔴 Alta severidad",
          "excluded_from_model": false,
          "lat": 4.1095,
          "lon": -76.37105
        },
        {
          "cod_municipio": "19573",
          "municipality": "PUERTO TEJADA",
          "department": "CAUCA",
          "icv_average": 27.91,
          "cluster_id": 1,
          "cluster_name": "🔴 Alta severidad",
          "excluded_from_model": false,
          "lat": 3.26673,
          "lon": -76.41846
        },
        {
          "cod_municipio": "52240",
          "municipality": "CHACHAGUI",
          "department": "NARIÑO",
          "icv_average": 27.25,
          "cluster_id": 1,
          "cluster_name": "🔴 Alta severidad",
          "excluded_from_model": false,
          "lat": 1.3865,
          "lon": -77.26969
        },
        {
          "cod_municipio": "76895",
          "municipality": "ZARZAL",
          "department": "VALLE DEL CAUCA",
          "icv_average": 27.15,
          "cluster_id": 1,
          "cluster_name": "🔴 Alta severidad",
          "excluded_from_model": false,
          "lat": 4.3536,
          "lon": -76.05065
        },
        {
          "cod_municipio": "76111",
          "municipality": "GUADALAJARA DE BUGA",
          "department": "VALLE DEL CAUCA",
          "icv_average": 26.99,
          "cluster_id": 1,
          "cluster_name": "🔴 Alta severidad",
          "excluded_from_model": false,
          "lat": 3.85525,
          "lon": -76.10514
        },
        {
          "cod_municipio": "76318",
          "municipality": "GUACARI",
          "department": "VALLE DEL CAUCA",
          "icv_average": 26.82,
          "cluster_id": 1,
          "cluster_name": "🔴 Alta severidad",
          "excluded_from_model": false,
          "lat": 3.78378,
          "lon": -76.29449
        },
        {
          "cod_municipio": "52540",
          "municipality": "POLICARPA",
          "department": "NARIÑO",
          "icv_average": 26.55,
          "cluster_id": 1,
          "cluster_name": "🔴 Alta severidad",
          "excluded_from_model": false,
          "lat": 1.73535,
          "lon": -77.48134
        },
        {
          "cod_municipio": "76377",
          "municipality": "LA CUMBRE",
          "department": "VALLE DEL CAUCA",
          "icv_average": 26.47,
          "cluster_id": 1,
          "cluster_name": "🔴 Alta severidad",
          "excluded_from_model": false,
          "lat": 3.6943,
          "lon": -76.5899
        },
        {
          "cod_municipio": "76670",
          "municipality": "SAN PEDRO",
          "department": "VALLE DEL CAUCA",
          "icv_average": 25.65,
          "cluster_id": 1,
          "cluster_name": "🔴 Alta severidad",
          "excluded_from_model": false,
          "lat": 3.9925910107012026,
          "lon": -76.22990373737325
        },
        {
          "cod_municipio": "76036",
          "municipality": "ANDALUCIA",
          "department": "VALLE DEL CAUCA",
          "icv_average": 25.42,
          "cluster_id": 1,
          "cluster_name": "🔴 Alta severidad",
          "excluded_from_model": false,
          "lat": 4.14485,
          "lon": -76.1647
        },
        {
          "cod_municipio": "52356",
          "municipality": "IPIALES",
          "department": "NARIÑO",
          "icv_average": 25.25,
          "cluster_id": 1,
          "cluster_name": "🔴 Alta severidad",
          "excluded_from_model": false,
          "lat": 0.8287535989713497,
          "lon": -77.64035810479157
        },
        {
          "cod_municipio": "76869",
          "municipality": "VIJES",
          "department": "VALLE DEL CAUCA",
          "icv_average": 25.23,
          "cluster_id": 1,
          "cluster_name": "🔴 Alta severidad",
          "excluded_from_model": false,
          "lat": 3.74366,
          "lon": -76.47065
        },
        {
          "cod_municipio": "76020",
          "municipality": "ALCALA",
          "department": "VALLE DEL CAUCA",
          "icv_average": 24.88,
          "cluster_id": 1,
          "cluster_name": "🔴 Alta severidad",
          "excluded_from_model": false,
          "lat": 4.6789,
          "lon": -75.78298
        },
        {
          "cod_municipio": "19698",